{
  "format": "openvn-story",
  "version": "0.4",
  "entry": "start-0001",
  "symbols": {
    "hopeful": "hopeful-0001",
    "quiet": "quiet-0001",
    "start": "start-0001"
  },
  "nodes": [
    {
      "id": "start-0001",
      "type": "scene",
      "background": "room",
      "next": "start-0002"
    },
    {
      "id": "start-0002",
      "type": "music",
      "track": "intro",
      "next": "start-0003"
    },
    {
      "id": "start-0003",
      "type": "show",
      "character": "alice",
      "pose": "neutral",
      "next": "start-0004"
    },
    {
      "id": "start-0004",
      "type": "set_bool",
      "name": "terminal_online",
      "value": true,
      "next": "start-0005"
    },
    {
      "id": "start-0005",
      "type": "set_int",
      "name": "trust",
      "value": 2,
      "next": "start-0006"
    },
    {
      "id": "start-0006",
      "type": "set_string",
      "name": "route",
      "value": "demo",
      "next": "start-0007"
    },
    {
      "id": "start-0007",
      "type": "condition",
      "condition": {
        "variable_name": "terminal_online",
        "value_type": "bool",
        "operator": "bool_true",
        "bool_value": false,
        "int_value": 0,
        "string_value": ""
      },
      "true_target": "start-0008",
      "false_target": "start-0010"
    },
    {
      "id": "start-0008",
      "type": "text",
      "text": "The terminal responds.",
      "next": "start-0009"
    },
    {
      "id": "start-0009",
      "type": "jump",
      "target": "start-0011"
    },
    {
      "id": "start-0010",
      "type": "text",
      "text": "The terminal remains dark.",
      "next": "start-0011"
    },
    {
      "id": "start-0011",
      "type": "condition",
      "condition": {
        "variable_name": "trust",
        "value_type": "int",
        "operator": ">=",
        "bool_value": false,
        "int_value": 2,
        "string_value": ""
      },
      "true_target": "start-0012",
      "false_target": "start-0014"
    },
    {
      "id": "start-0012",
      "type": "text",
      "text": "Alice decides to continue.",
      "next": "start-0013"
    },
    {
      "id": "start-0013",
      "type": "jump",
      "target": "start-0015"
    },
    {
      "id": "start-0014",
      "type": "text",
      "text": "Alice steps away.",
      "next": "start-0015"
    },
    {
      "id": "start-0015",
      "type": "condition",
      "condition": {
        "variable_name": "route",
        "value_type": "string",
        "operator": "==",
        "bool_value": false,
        "int_value": 0,
        "string_value": "demo"
      },
      "true_target": "start-0016",
      "false_target": "start-0018"
    },
    {
      "id": "start-0016",
      "type": "text",
      "text": "The route marker is deterministic.",
      "next": "start-0017"
    },
    {
      "id": "start-0017",
      "type": "jump",
      "target": "start-0019"
    },
    {
      "id": "start-0018",
      "type": "text",
      "text": "The route marker changed unexpectedly.",
      "next": "start-0019"
    },
    {
      "id": "start-0019",
      "type": "text",
      "text": "Alice switches on the old terminal. The OpenVN demo is running on one shared story.",
      "next": "start-0020"
    },
    {
      "id": "start-0020",
      "type": "sound",
      "sound": "click",
      "next": "start-0021"
    },
    {
      "id": "start-0021",
      "type": "text",
      "text": "The screen asks which path to demonstrate.",
      "next": "start-0022"
    },
    {
      "id": "start-0022",
      "type": "choice",
      "options": [
        {
          "text": "Show the hopeful ending",
          "target": "hopeful-0001"
        },
        {
          "text": "Show the quiet ending",
          "target": "quiet-0001"
        }
      ]
    },
    {
      "id": "hopeful-0001",
      "type": "text",
      "text": "Alice smiles as the scene, portrait, choice, music, and sound complete one vertical slice.",
      "next": "hopeful-0002"
    },
    {
      "id": "hopeful-0002",
      "type": "hide",
      "character": "alice",
      "next": "hopeful-0003"
    },
    {
      "id": "hopeful-0003",
      "type": "music",
      "track": null,
      "next": "hopeful-0004"
    },
    {
      "id": "hopeful-0004",
      "type": "text",
      "text": "ENDING: A New Story",
      "next": "hopeful-0005"
    },
    {
      "id": "hopeful-0005",
      "type": "end"
    },
    {
      "id": "quiet-0001",
      "type": "text",
      "text": "Alice lets the music play for one final moment before closing the terminal.",
      "next": "quiet-0002"
    },
    {
      "id": "quiet-0002",
      "type": "hide",
      "character": "alice",
      "next": "quiet-0003"
    },
    {
      "id": "quiet-0003",
      "type": "music",
      "track": null,
      "next": "quiet-0004"
    },
    {
      "id": "quiet-0004",
      "type": "text",
      "text": "ENDING: The Last Note",
      "next": "quiet-0005"
    },
    {
      "id": "quiet-0005",
      "type": "end"
    }
  ]
}
